{
  "$schema": "https://json-schema.org/draft/2020-12/schema",
  "$id": "https://bluecontract.org/schemas/coordination/latest-language-embedded-collections-run.schema.json",
  "title": "Blue Coordination same-run embedded-collections evidence",
  "type": "object",
  "required": [
    "schema",
    "run",
    "coordination",
    "dependencies",
    "migration",
    "fragmentation",
    "subscriptions",
    "performance",
    "tests",
    "conformance",
    "flagshipMatrix",
    "providerDemands",
    "api",
    "reproducibility",
    "blockers",
    "gates"
  ],
  "properties": {
    "schema": {
      "const": "blue-coordination/latest-language-embedded-collections-run/1.0"
    },
    "run": {
      "$ref": "#/$defs/run"
    },
    "coordination": {
      "type": "object",
      "required": ["commit"],
      "properties": {
        "commit": { "$ref": "#/$defs/gitSha" },
        "version": { "type": ["string", "null"] },
        "dirty": { "type": "boolean" }
      },
      "additionalProperties": true
    },
    "dependencies": { "$ref": "#/$defs/receipt" },
    "migration": { "$ref": "#/$defs/receipt" },
    "fragmentation": { "$ref": "#/$defs/receipt" },
    "subscriptions": {
      "allOf": [
        { "$ref": "#/$defs/receipt" },
        {
          "type": "object",
          "required": ["projectionTotals", "updateTotals"],
          "properties": {
            "projectionTotals": { "$ref": "#/$defs/totals" },
            "updateTotals": { "$ref": "#/$defs/totals" }
          }
        }
      ]
    },
    "performance": { "$ref": "#/$defs/receipt" },
    "tests": {
      "allOf": [
        { "$ref": "#/$defs/receipt" },
        {
          "type": "object",
          "required": ["ordinary", "collectionSpecific", "failureClassifications"],
          "properties": {
            "ordinary": { "$ref": "#/$defs/totals" },
            "collectionSpecific": { "$ref": "#/$defs/totals" },
            "failureClassifications": { "$ref": "#/$defs/failureClassifications" }
          }
        }
      ]
    },
    "conformance": {
      "allOf": [
        { "$ref": "#/$defs/receipt" },
        {
          "type": "object",
          "required": ["totals", "failureClassifications"],
          "properties": {
            "totals": { "$ref": "#/$defs/totals" },
            "failureClassifications": { "$ref": "#/$defs/failureClassifications" }
          }
        }
      ]
    },
    "flagshipMatrix": {
      "allOf": [
        { "$ref": "#/$defs/receipt" },
        {
          "type": "object",
          "required": ["totals", "failureClassifications"],
          "properties": {
            "totals": { "$ref": "#/$defs/totals" },
            "failureClassifications": { "$ref": "#/$defs/failureClassifications" }
          }
        }
      ]
    },
    "providerDemands": {
      "allOf": [
        { "$ref": "#/$defs/receipt" },
        {
          "type": "object",
          "required": ["total", "forbidden"],
          "properties": {
            "total": { "$ref": "#/$defs/nonNegativeInteger" },
            "forbidden": { "$ref": "#/$defs/nonNegativeInteger" }
          }
        }
      ]
    },
    "api": {
      "allOf": [
        { "$ref": "#/$defs/receipt" },
        {
          "type": "object",
          "required": ["splitPackageCount", "packageCycleCount"],
          "properties": {
            "splitPackageCount": { "$ref": "#/$defs/nonNegativeInteger" },
            "packageCycleCount": { "$ref": "#/$defs/nonNegativeInteger" },
            "changes": {
              "type": "array",
              "items": { "type": "object" }
            }
          }
        }
      ]
    },
    "reproducibility": { "$ref": "#/$defs/receipt" },
    "blockers": {
      "type": "array",
      "items": {
        "type": "object",
        "required": ["id", "owner", "classification"],
        "properties": {
          "id": { "$ref": "#/$defs/nonEmptyText" },
          "owner": { "$ref": "#/$defs/nonEmptyText" },
          "classification": { "$ref": "#/$defs/nonEmptyText" }
        },
        "additionalProperties": true
      }
    },
    "gates": {
      "type": "array",
      "minItems": 1,
      "items": {
        "allOf": [
          { "$ref": "#/$defs/receipt" },
          {
            "type": "object",
            "required": ["name"],
            "properties": {
              "name": { "$ref": "#/$defs/nonEmptyText" }
            }
          }
        ]
      }
    }
  },
  "additionalProperties": false,
  "$defs": {
    "nonEmptyText": {
      "type": "string",
      "minLength": 1
    },
    "gitSha": {
      "type": "string",
      "pattern": "^[0-9a-f]{40}$"
    },
    "nonNegativeInteger": {
      "type": "integer",
      "minimum": 0
    },
    "status": {
      "enum": ["passed", "failed", "notExecuted"]
    },
    "run": {
      "type": "object",
      "required": ["id", "startedAt", "finishedAt"],
      "properties": {
        "id": { "$ref": "#/$defs/nonEmptyText" },
        "startedAt": { "type": "string", "format": "date-time" },
        "finishedAt": { "type": "string", "format": "date-time" }
      },
      "additionalProperties": false
    },
    "receipt": {
      "type": "object",
      "required": ["runId", "status"],
      "properties": {
        "runId": { "$ref": "#/$defs/nonEmptyText" },
        "status": { "$ref": "#/$defs/status" },
        "reason": { "type": "string" }
      },
      "additionalProperties": true
    },
    "totals": {
      "type": "object",
      "required": ["passed", "failed", "skipped", "unclassified"],
      "properties": {
        "executed": { "$ref": "#/$defs/nonNegativeInteger" },
        "passed": { "$ref": "#/$defs/nonNegativeInteger" },
        "failed": { "$ref": "#/$defs/nonNegativeInteger" },
        "skipped": { "$ref": "#/$defs/nonNegativeInteger" },
        "unclassified": { "$ref": "#/$defs/nonNegativeInteger" }
      },
      "additionalProperties": true
    },
    "failureClassifications": {
      "type": "object",
      "required": [
        "failed",
        "classified",
        "unclassified",
        "external",
        "coordinationOwned",
        "categories",
        "unknown"
      ],
      "properties": {
        "failed": { "$ref": "#/$defs/nonNegativeInteger" },
        "classified": { "$ref": "#/$defs/nonNegativeInteger" },
        "unclassified": { "$ref": "#/$defs/nonNegativeInteger" },
        "external": { "$ref": "#/$defs/nonNegativeInteger" },
        "coordinationOwned": { "$ref": "#/$defs/nonNegativeInteger" },
        "categories": {
          "type": "array",
          "items": {
            "type": "object",
            "required": ["id", "owner", "external", "count", "sampleTestIds"],
            "properties": {
              "id": { "$ref": "#/$defs/nonEmptyText" },
              "owner": { "$ref": "#/$defs/nonEmptyText" },
              "external": { "type": "boolean" },
              "count": { "$ref": "#/$defs/nonNegativeInteger" },
              "sampleTestIds": {
                "type": "array",
                "items": { "$ref": "#/$defs/nonEmptyText" }
              }
            },
            "additionalProperties": false
          }
        },
        "unknown": {
          "type": "array",
          "items": {
            "type": "object",
            "required": ["testId", "type", "messageExcerpt", "messageSha256"],
            "properties": {
              "testId": { "$ref": "#/$defs/nonEmptyText" },
              "type": { "$ref": "#/$defs/nonEmptyText" },
              "messageExcerpt": { "$ref": "#/$defs/nonEmptyText" },
              "messageSha256": {
                "type": "string",
                "pattern": "^[0-9a-f]{64}$"
              }
            },
            "additionalProperties": false
          }
        }
      },
      "additionalProperties": false
    }
  }
}
