{
  "schema": "blue-coordination/latest-language-embedded-collections-run/1.0",
  "run": {
    "id": "fixture-run-2026-08-03",
    "startedAt": "2026-08-03T10:00:00Z",
    "finishedAt": "2026-08-03T10:05:00Z"
  },
  "coordination": {
    "commit": "1111111111111111111111111111111111111111",
    "version": "fixture",
    "dirty": false
  },
  "dependencies": {
    "runId": "fixture-run-2026-08-03",
    "status": "passed",
    "language": {
      "commit": "2222222222222222222222222222222222222222",
      "version": "fixture-language"
    },
    "bex": {
      "commit": "3333333333333333333333333333333333333333",
      "version": "fixture-bex",
      "workingReady": true,
      "moduleJarHashes": {
        "blue-bex-core": "aaaaaaaaaaaaaaaaaaaaaaaaaaaaaaaaaaaaaaaaaaaaaaaaaaaaaaaaaaaaaaaa"
      }
    },
    "repository": {
      "commit": "4444444444444444444444444444444444444444",
      "version": "fixture-repository"
    },
    "resolvedModuleGraph": {
      "blue.language:blue-contracts-core": ":blue-contracts-core",
      "blue.bex:blue-bex-core": ":blue-bex-core"
    },
    "packageIdentities": {
      "contractsRegistry": "sha256:fixture-contracts-registry"
    },
    "artifactIdentities": {
      "coordinationJar": "sha256:fixture-coordination-jar"
    }
  },
  "migration": {
    "runId": "fixture-run-2026-08-03",
    "status": "passed",
    "legacyImportCount": 0,
    "oldBexAdapterCount": 0
  },
  "fragmentation": {
    "runId": "fixture-run-2026-08-03",
    "status": "passed",
    "catalogMemberCount": 7,
    "fragmentCount": 11,
    "maximumGasTrace": {
      "total": 47,
      "entries": 9
    }
  },
  "subscriptions": {
    "runId": "fixture-run-2026-08-03",
    "status": "passed",
    "projectionTotals": {
      "passed": 3,
      "failed": 0,
      "skipped": 0,
      "unclassified": 0
    },
    "updateTotals": {
      "passed": 4,
      "failed": 0,
      "skipped": 0,
      "unclassified": 0
    },
    "occurrenceCount": 7
  },
  "performance": {
    "runId": "fixture-run-2026-08-03",
    "status": "passed",
    "jmhCampaignSummary": {
      "lanesExecuted": 4,
      "lanesRejected": 0
    }
  },
  "tests": {
    "runId": "fixture-run-2026-08-03",
    "status": "passed",
    "ordinary": {
      "passed": 10,
      "failed": 0,
      "skipped": 0,
      "unclassified": 0
    },
    "collectionSpecific": {
      "passed": 6,
      "failed": 0,
      "skipped": 0,
      "unclassified": 0
    },
    "failureClassifications": {
      "failed": 0,
      "classified": 0,
      "unclassified": 0,
      "external": 0,
      "coordinationOwned": 0,
      "categories": [],
      "unknown": []
    }
  },
  "conformance": {
    "runId": "fixture-run-2026-08-03",
    "status": "passed",
    "totals": {
      "passed": 5,
      "failed": 0,
      "skipped": 0,
      "unclassified": 0
    },
    "failureClassifications": {
      "failed": 0,
      "classified": 0,
      "unclassified": 0,
      "external": 0,
      "coordinationOwned": 0,
      "categories": [],
      "unknown": []
    }
  },
  "flagshipMatrix": {
    "runId": "fixture-run-2026-08-03",
    "status": "passed",
    "totals": {
      "passed": 8,
      "failed": 0,
      "skipped": 0,
      "unclassified": 0
    },
    "failureClassifications": {
      "failed": 0,
      "classified": 0,
      "unclassified": 0,
      "external": 0,
      "coordinationOwned": 0,
      "categories": [],
      "unknown": []
    },
    "semanticVariants": 8
  },
  "providerDemands": {
    "runId": "fixture-run-2026-08-03",
    "status": "passed",
    "total": 13,
    "forbidden": 0,
    "bytes": 2048
  },
  "api": {
    "runId": "fixture-run-2026-08-03",
    "status": "passed",
    "splitPackageCount": 0,
    "packageCycleCount": 0,
    "changes": [
      {
        "kind": "removed",
        "symbol": "fixture.legacy.Adapter"
      }
    ]
  },
  "reproducibility": {
    "runId": "fixture-run-2026-08-03",
    "status": "passed",
    "digests": {
      "jar": "bbbbbbbbbbbbbbbbbbbbbbbbbbbbbbbbbbbbbbbbbbbbbbbbbbbbbbbbbbbbbbbb"
    }
  },
  "blockers": [],
  "gates": [
    {
      "runId": "fixture-run-2026-08-03",
      "name": "fixtureWorkingVerification",
      "status": "passed"
    }
  ]
}
